id,text,difficulty,max_rank,rank,topics
6440117,How much butter is left?,B2,3605,1907,shopping & prices
2264595,A machine had to be installed in the factory.,B2,3632,1908,
32513,I'd like to live in a decent house.,B2,3616,1909,
297697,"He asked me my age, my name, my address, and so forth.",B2,3625,1910,
6514511,We know Tom and Mary are decent people.,B2,3616,1911,
8511875,I suggest that you wear an extra layer.,B2,3635,1912,
897322,The nurse applied a medicine to the affected part.,B2,3640,1913,negation
12387139,I do not have enemies.,B2,3623,1914,
3115942,This describes me so perfectly!,B2,3619,1915,
12003882,She hopes to find us by her side.,B2,3630,1916,
7767728,I wish to marry you.,B2,3637,1917,
5747260,That's what I pray for.,B2,3648,1918,
8433210,I don't want to raise your hopes.,B2,3630,1919,
3219385,A man I didn't know was walking back and forth in front of my house.,B2,3625,1920,
311056,As head of the sales team she reports only to the managing director.,B2,3636,1921,
10314498,The participants were for the most part young people.,B2,3644,1922,
62444,Ken couldn't recall his name.,B2,3650,1923,
6678430,Sami has met a woman he's going to marry.,B2,3637,1924,
303083,He filed the surface smooth.,B2,3655,1925,
6445611,Sami had an interesting spiritual experience.,B2,3656,1926,
6772059,I like writing poetry.,B2,3646,1927,likes & dislikes
687352,You must obtain approval before you can go.,B2,3641,1928,
7171930,I thought that you were a nurse.,B2,3640,1929,
287398,Nobody expected that his condition would take a sudden turn.,B2,3659,1930,
998996,How many stops is it from here?,B2,3657,1931,"directions & locations,numbers & counting"
8367091,Tom is a rugby player.,B2,3651,1932,sports
10267217,The change in weather was sudden.,B2,3659,1933,
13195685,I think it needs less sake next time.,B2,3652,1934,
12185678,She's nowhere to be found.,B2,3639,1935,
11608059,The guy throwing the party was William.,B2,3662,1936,
7792707,Tom lives and works on an organic farm.,B2,3642,1937,
7494346,Where did she get this sheet music?,B2,3653,1938,
12259375,His hands are smooth.,B2,3655,1939,"possession (my, your, his)"
12104539,Cross your fingers and pray.,B2,3648,1940,
7795939,I printed many copies of the insurance contract.,B2,3649,1941,
2065143,I can't recall all their names.,B2,3650,1942,
2293280,I assumed we'd all do this together.,B2,3669,1943,
3733360,No one will bother you here.,B2,3672,1944,
9314679,That's what I assumed had happened.,B2,3669,1945,
24318,I worked in a post office during the summer vacation.,B2,3664,1946,"days, months & seasons"
1654511,It's a popular vacation spot.,B2,3664,1947,
682154,"By signing a contract, you agree to certain terms and conditions.",B2,3654,1948,
2751136,A string on my guitar broke.,B2,3658,1949,"possession (my, your, his)"
7724835,This needs to be thrown away.,B2,3663,1950,
8023679,Let's wait for a while and see if the rain stops.,B2,3657,1951,
10574505,I can't drink sake.,B2,3652,1952,likes & dislikes
13060487,A society consists of many people.,B2,3679,1953,
680518,They're cleaning the beach.,B2,3677,1954,
11038718,He's cleaning the windows.,B2,3677,1955,
12090150,I made room for Tom on the bench.,B2,3671,1956,
8351231,We shouldn't let that bother us.,B2,3672,1957,
6856836,Would you like to study abroad?,B2,3665,1958,language learning
3758713,What do you associate this song with?,B2,3668,1959,
6042690,I love both my parents equally.,B2,3689,1960,family & relationships
297657,He assigned me a new job.,B2,3667,1961,
3076628,Going to live abroad is a major decision.,B2,3665,1962,language learning
8789883,I figured.,B2,3691,1963,
6443394,The football match was broadcast live on television.,B2,3673,1964,sports
5964835,No one's standing in front of the entrance.,B2,3688,1965,negation
11504236,James was patient with that disaster.,B2,3685,1966,
9965898,Have you ever fallen off your horse?,B2,3690,1967,animals
2164623,She's an intense woman.,B2,3698,1968,
11023174,We'll discover the truth one day.,B2,3686,1969,future plans & goals
11593655,I have never played cricket.,B2,3682,1970,"sports,negation"
2167181,Bye for now.,B2,3674,1971,greetings & introductions
13064631,Friendship is a support in difficult times.,B2,3694,1972,
7294621,Sami was telling me bye.,B2,3674,1973,greetings & introductions
295762,He contributed a lot of money for the sake of art.,B2,3681,1974,
7406150,They've hired themselves good lawyers.,B2,3700,1975,
1821420,You want to be lawyers.,B2,3700,1976,
4314043,Friendship is the salt of life.,B2,3694,1977,
269564,True happiness consists of desiring little.,B2,3679,1978,
7396459,He figured he couldn't afford it.,B2,3691,1979,
12664634,Is this road damaged?,B2,3684,1980,
1208886,Take the keys to your brother.,B2,3699,1981,family & relationships
10359643,I'll wait for you at main entrance.,B2,3688,1982,directions & locations
13243513,What is liquid?,B2,3702,1983,
59338,That word has fallen out of use.,B2,3690,1984,
8780655,The road to the village is narrow.,B2,3707,1985,directions & locations
7126729,How will we pay the mortgage?,B2,3705,1986,
10221621,The rain will be occasionally heavy.,B2,3710,1987,
6924073,You can see the ocean from this narrow field-of-view.,B2,3707,1988,
260065,I observed him stop.,B2,3709,1989,
6871023,It would have been silly to do that.,B2,3727,1990,
6252847,It would've been silly to do that.,B2,3727,1991,
261614,I'm not in the least interested in physics.,B2,3713,1992,"likes & dislikes,negation"
2248021,I'm handling this.,B2,3696,1993,basic verbs & actions
11766888,The soccer match was intense for Gustavo.,B2,3698,1994,"sports,emotions"
3733504,It was an offer I couldn't refuse.,B2,3718,1995,negation
7476503,They mortgaged their house.,B2,3705,1996,
13186068,Why did she refuse?,B2,3718,1997,
273416,I believe the ship will arrive on schedule.,B2,3739,1998,future plans & goals
11721251,He began to connect the things that had happened to him.,B2,3746,1999,
10912763,Natural gas is an important natural resource.,B2,3720,2000,
9927988,The sound of the rain needs no translation.,B2,3731,2001,
8529256,"She's majoring in physics, isn't she?",B2,3713,2002,
10357748,That hotel serves good food.,B2,3725,2003,at the restaurant
264667,It is time to reflect on your past.,B2,3717,2004,
9037545,Yanni was incredibly tired for some reason.,B2,3761,2005,emotions
13227278,The past serves as a map for the future.,B2,3725,2006,future plans & goals
54903,A further reduction would make us go into the red.,B2,3716,2007,
9925930,He doesn't accept gifts.,B2,3757,2008,negation
425843,It's completely visible.,B2,3732,2009,
11414079,They got defensive.,B2,3747,2010,emotions
11117979,Her words are gifts.,B2,3757,2011,
317882,The people for the experiment were chosen at random.,B2,3751,2012,
6116674,Shooting from a low angle makes your legs appear longer.,B2,3737,2013,
323008,"It began to be light, and things were becoming visible by degrees.",B2,3732,2014,
3342903,I'm not being defensive.,B2,3747,2015,basic verbs & actions
5858131,I kicked the ball.,B2,3765,2016,basic verbs & actions
255200,I sometimes lie on the grass.,B2,3758,2017,
11217384,Which district does this number belong to?,B2,3740,2018,
56642,Let's approach this problem from a different angle.,B2,3737,2019,
11294139,What's the happy occasion?,B2,3771,2020,
4628907,"If you think this forum is just work for you, then you should give up.",B2,3756,2021,"possession (my, your, his)"
12436680,Who does this ball belong to?,B2,3740,2022,
5961594,Pick up the pace.,B2,3773,2023,"sports,basic verbs & actions"
11766877,Gustavo kicked the soccer ball into the goal.,B2,3765,2024,
12575148,Your life is shaped by the different people you meet in your life.,B2,3784,2025,
10613406,I think I was just incredibly lucky.,B2,3761,2026,
436297,I am a journalist.,B2,3764,2027,
3127924,My findings suggest that that is not the case.,B2,3754,2028,
13039322,I focus on important subjects.,B2,3788,2029,
10039110,He built his house over the rocks.,B2,3783,2030,
10936677,You can learn some lessons from this.,B2,3766,2031,
12777883,Is life a series of lessons?,B2,3766,2032,
5741680,How valid are the results?,B2,3792,2033,
11592686,Your name isn't on the passenger list.,B2,3774,2034,"possession (my, your, his)"
11232166,The bank took possession of the land.,B2,3777,2035,
5744235,We were off to the races.,B2,3779,2036,
11892885,Can I take your car for a spin?,B2,3786,2037,polite requests & manners
5757784,We all love lists.,B2,3767,2038,likes & dislikes
17424,Is your apartment well maintained?,B2,3768,2039,
11634056,The cop asked for Jonas's idea.,B2,3804,2040,
11493049,Donald came back to collect his check.,B2,3802,2041,"possession (my, your, his)"
3444467,Tom opened the passenger door for Mary.,B2,3774,2042,
4999798,I'm not sure that's suitable.,B2,3790,2043,negation
10657309,"For most people, emotions still remain a mystery.",B2,3807,2044,emotions
1349639,It is vital that you be present.,B2,3793,2045,
292689,He got out his pen.,B2,3775,2046,"possession (my, your, his)"
1887228,I don't have a dress good enough for such an occasion.,B2,3771,2047,negation
2756637,This place is suitable for swimming.,B2,3790,2048,
12971542,"It might not be a genuine problem, but this is what we notice.",B2,3811,2049,negation
8638803,It's not a bank. It's a currency exchange office.,B2,3806,2050,negation
58143,The current of this river is rapid.,B2,3780,2051,
8782985,He is a man of honour.,B2,3815,2052,
7653713,"Although I grew up on a farm, I don't know much about agriculture.",B2,3796,2053,
11543437,Focus on improving your academic writing.,B2,3819,2054,
5045137,They were one of my favorite bands in high school.,B2,3800,2055,
9999387,The exhibition is open to the public.,B2,3808,2056,
3821242,Is that a valid reason?,B2,3792,2057,
6080683,Do you do any programming yourself?,B2,3835,2058,
9480616,Please introduce me to your friends.,B2,3821,2059,"polite requests & manners,greetings & introductions"
8477825,He isn't a cop.,B2,3804,2060,negation
11921035,How many eggs did you collect?,B2,3802,2061,numbers & counting
5852627,I'm improving.,B2,3819,2062,language learning
318171,Did you go to the art exhibition?,B2,3808,2063,
5746271,My feelings are genuine.,B2,3811,2064,emotions
5545235,On my honour!,B2,3815,2065,
11121369,Who's the woman sitting on the log?,B2,3826,2066,greetings & introductions
6209979,I asked him to introduce her to me.,B2,3821,2067,polite requests & manners
12311605,She rejected his help.,B2,3839,2068,
7119693,Am I scary?,B2,3845,2069,emotions
6569180,I hope I don't regret doing this.,B2,3838,2070,emotions
11889529,Pay attention and follow the instructions carefully.,B2,3820,2071,polite requests & manners
12898761,Do dogs like honey?,B2,3814,2072,animals
10784193,Remind me to take my medicine.,B2,3840,2073,polite requests & manners
12251368,My cat likes to sit in front of my monitor when she thinks it's time to be fed.,B2,3829,2074,"animals,likes & dislikes,possession (my, your, his)"
2674443,I'm having trouble reading the letters on the monitor.,B2,3829,2075,
11098907,His request for time off was rejected.,B2,3839,2076,"possession (my, your, his)"
6550160,It's a routine procedure.,B2,3844,2077,
12766100,Did the island offer any survival training programs?,B2,3851,2078,
12848229,She arrived at the resort.,B2,3841,2079,
10734206,Can you spell it out?,B2,3849,2080,polite requests & manners
6622239,You shouldn't do it merely to please me.,B2,3828,2081,polite requests & manners
13178962,Your membership is not automatic.,B2,3862,2082,"possession (my, your, his),negation"
4471104,Nobody should settle for less when they deserve more.,B2,3847,2083,negation
1343783,"It's time to start seeding, he said.",B2,3846,2084,"days, months & seasons"
1996127,He's looking for a job in computer programming.,B2,3835,2085,future plans & goals
282343,The waves carried me off my feet.,B2,3855,2086,
8528089,"He's already asleep, isn't he?",B2,3860,2087,
7249963,Sami could burn any CD he wanted.,B2,3865,2088,animals
12169212,His eyes remind me of those of a cat.,B2,3840,2089,animals
13320888,She wants to ward off bad luck.,B2,3854,2090,
2292289,I want to settle down.,B2,3847,2091,future plans & goals
10600055,You gave a comprehensive answer.,B2,3868,2092,
59031,This attempt resulted in failure.,B2,3842,2093,
9192740,"Spring is over, and summer has begun.",B2,3863,2094,"days, months & seasons"
11774624,Antonio began his usual routine.,B2,3844,2095,
51649,"Could you spell it, please?",B2,3849,2096,polite requests & manners
10306228,The reverse is not always true.,B2,3843,2097,
4663696,Tom told Mary that he wanted a divorce.,B2,3874,2098,
306505,They drove the car one after the other.,B2,3876,2099,
1702326,The work has already begun.,B2,3863,2100,
8514756,She stuck her tongue out at him.,B2,3853,2101,
12382652,"She walked along the beach, listening to the waves.",B2,3855,2102,
2547270,I'll just get my coat.,B2,3867,2103,
11909059,Medicine is the study of diseases.,B2,3873,2104,
11473327,It's extraordinary.,B2,3879,2105,
260179,I argued with him about it.,B2,3859,2106,
4902755,Tom drove to the hospital.,B2,3876,2107,
1312839,I argued with Yoko a little bit.,B2,3859,2108,
1719444,I put my fate in your beautiful hands.,B2,3880,2109,"possession (my, your, his)"
11277351,They did that without my consent.,B2,3869,2110,
10126554,"If the parents were to change their own behaviour, then their child's would surely change as well.",B2,3864,2111,
5141935,Every great achievement was once considered impossible.,B2,3857,2112,
12777656,Can we control our own fate?,B2,3880,2113,
10489907,The landscape became flat once again.,B2,3891,2114,
20733,Companies welcome workers who take initiative.,B2,3887,2115,
8376950,You can stop covering your ears now. The TV is off.,B2,3877,2116,
3077856,The readers are the real target of interviews.,B2,3888,2117,
9840646,Can I have a glass of apple juice?,B2,3890,2118,polite requests & manners
12250245,I found something extraordinary.,B2,3879,2119,
7888315,This landscape looks like a different planet.,B2,3891,2120,
9807278,I've already picked out the next CD that I'm going to buy.,B2,3865,2121,future plans & goals
262944,We ran for the glory of the school.,B2,3884,2122,
12474050,Did you phone headquarters?,B2,3885,2123,
253172,I split the profits with my cousin.,B2,3900,2124,family & relationships
287692,His objective is to pass the test.,B2,3896,2125,
5175135,I want some privacy.,B2,3898,2126,
5830779,The scoring area is called the end zone.,B2,3907,2127,
3395886,What are you searching for?,B2,3909,2128,
12319667,Did you read the whole script?,B2,3908,2129,
8894153,We both arrived roughly at the same time.,B2,3905,2130,
64519,Let's agree to share in the profits.,B2,3900,2131,
9379433,The salary isn't enough for him to deal with even the running costs.,B2,3906,2132,
12031396,What is your current place of residence?,B2,3904,2133,
12235573,They settled where the river meets the sea.,B2,3893,2134,
2111639,Keep searching.,B2,3909,2135,
8705935,Many universities have moved to the pass/fail option.,B2,3916,2136,
1147080,Did you know that men can get breast cancer?,B2,3927,2137,directions & locations
12245505,She lives near the tube station.,B2,3915,2138,family & relationships
12621413,He writes letters to his friend.,B2,3920,2139,
12882395,We had no regard for money at all.,B2,3902,2140,
28244,The commission concluded that the answer was no.,B2,3932,2141,
907001,A page of history is worth a volume of logic.,B2,3892,2142,
6025243,I don't use that site for privacy reasons.,B2,3898,2143,
716451,She threatened to tell on me.,B2,3913,2144,
8680483,He meets a lot of people online.,B2,3893,2145,
10727078,Well that's roughly what I thought.,B2,3905,2146,
13138695,"If it's a thing related to chemistry, leave it to me!",B2,3931,2147,
9795578,I wanted some orange cotton pants.,B2,3935,2148,
7426738,We'll make an exception of your case.,B2,3942,2149,animals
10110671,"I'm surrounded by cats! ""Sounds like a nice problem to have.""",B2,3912,2150,
4136738,He was awarded an order.,B2,3925,2151,
7786185,Do you put cotton in your ears when you go to a concert?,B2,3935,2152,
11688942,Claudio will give Isabella a discount.,B2,3938,2153,
12777351,She writes articles about contemporary art.,B2,3920,2154,polite requests & manners
2883411,Could you please expand the topic a little?,B2,3944,2155,
2218107,You're being transferred.,B2,3914,2156,
10091630,You input a code; a key is not required.,B2,3953,2157,
3911632,What's your impression of her?,B2,3950,2158,emotions
7402811,He said that he's grateful.,B2,3947,2159,
11058992,The engines were tested.,B2,3940,2160,
5085459,Limit the consumption of white sugar and salt.,B2,3933,2161,
7983475,Sami has long gorgeous hair.,B2,3946,2162,
1854191,"Whenever I'm on top of a mountain, I feel grateful.",B2,3947,2163,
812160,I saw how he crossed the road.,B2,3936,2164,
858573,He decided to be operated on.,B2,3965,2165,
11488947,Donald started to search for an emergency exit.,B2,3943,2166,
10755690,This is the fire exit.,B2,3943,2167,
31283,Can you give me a discount?,B2,3938,2168,
289073,He always takes note of his boss's movements.,B2,3963,2169,
5852286,What'll the outcome be?,B2,3967,2170,
8540056,Is that leather?,B2,3957,2171,
6698006,How do you always manage to look so gorgeous?,B2,3946,2172,
1422986,Indicate the correct option.,B2,3952,2173,
301863,I fancied that he was angry.,B2,3945,2174,
11602741,William preferred to work alone.,B2,3970,2175,
2246047,I read lips.,B2,3958,2176,
8390779,They have a secret knock.,B2,3956,2177,
10153514,There was a sudden knock at the door in the evening.,B2,3956,2178,
2015211,I want to make a good impression.,B2,3950,2179,
318484,The patient moved his lips slightly.,B2,3958,2180,
4144814,The president handed the speech to the reporter.,B2,3976,2181,
6350387,I'd have preferred you do that.,B2,3970,2182,
12773450,Do you think they were aware of the risks?,B2,3978,2183,
48767,The reporter filed his story just before the paper went to press.,B2,3976,2184,
2361270,I don't know what you're referring to.,B2,3973,2185,
11124124,I don't know the lyrics to this song.,B2,3960,2186,
7263824,Sami said that getting paid at that bar was like pulling teeth.,B2,3971,2187,
304882,He lives in luxury.,B2,3959,2188,
682033,Their voices sound similar over the phone.,B2,3993,2189,
11596386,Robert hardly had any luxuries.,B2,3959,2190,
276635,Nobody could remember the sequence of events.,B2,3982,2191,
33812,I had hardly sat down on the bench when I found it had just been painted.,B2,3968,2192,
2639920,You were so good at tennis. Why did you give it up?,B2,3986,2193,
9505195,We need to know the outcome.,B2,3967,2194,
4329011,"Dear friends, many thanks for the birthday wishes.",B2,3994,2195,
7736953,I can't believe we ate all that.,B2,3999,2196,
1950670,We can't afford to take risks like that.,B2,3978,2197,
8946794,A doctor ought to have a look at that.,B2,3966,2198,
11729216,Adriano wishes he could have more confidence in public speaking.,B2,3994,2199,
5485360,The blue sky seemed to stretch forever.,B2,3984,2200,
10694470,"The sales assistant showed me a lot of ties, but there wasn't one I liked.",B2,3989,2201,
2652950,It brought a tear to my eye.,B2,3985,2202,
8150497,The shop is on the other side of the theater.,B2,3988,2203,
1887406,I heard voices.,B2,3993,2204,
252068,Please keep me informed of whatever happens in my absence.,B2,3996,2205,
9964905,Tell me where to put these boxes.,B2,4003,2206,
11696512,Flavio ran back into the theater.,B2,3988,2207,
11790647,It's not always easy to tear down old buildings.,B2,3985,2208,
11690386,Some couples take a long time to get to know each other.,B2,4011,2209,family & relationships
12827310,Take care of him during my absence.,B2,3996,2210,
23283,We should deny our children things too sweet.,B2,4013,2211,
10650460,I saw a wolf.,B2,3995,2212,animals
8506636,Bears are very smart.,B2,4001,2213,animals
324448,I often get the blues.,B2,4002,2214,emotions
8406804,She ate lunch early.,B2,3999,2215,basic verbs & actions
8970005,Bears like honey just as much as people do.,B2,4001,2216,animals
7397675,She looked like she was impressed.,B2,4022,2217,emotions
10794752,This cake is delicious! Where did you buy it?,B2,4012,2218,"shopping & prices,likes & dislikes"
240414,There were a lot of young couples in the park.,B2,4011,2219,family & relationships
9142673,Tom is like a bull in a china shop.,B2,4005,2220,
12776763,He made her laugh with ease.,B2,4015,2221,
2181079,You can use or contribute to this project.,B2,4008,2222,
3315236,How big was your contribution?,B2,4009,2223,numbers & counting
1821100,How many passengers can this plane hold?,B2,4035,2224,numbers & counting
11176479,I would like to contribute.,B2,4008,2225,
327389,Can I extend my stay?,B2,4016,2226,polite requests & manners
7332508,"When I was a child, I liked to drink weak instant coffee.",B2,4024,2227,likes & dislikes
505526,I can't find my glasses. I may have left them behind in the train.,B2,4021,2228,negation
8429676,I recommend that you number the boxes.,B2,4003,2229,
13277331,Everyone deserves their privacy.,B2,4014,2230,
6203103,"If you would be a good reader, read; if a writer, write.",B2,4043,2231,negation
7582413,I almost never drink instant coffee.,B2,4024,2232,
6759906,There are cameras outside the building.,B2,4006,2233,
10026672,Yanni wants power and fame.,B2,4017,2234,
270128,People usually go after fame.,B2,4017,2235,
9176795,My job involves helping people solve problems.,B2,4026,2236,
12082698,Michael won the race with ease.,B2,4015,2237,
8946571,Investors like what they see.,B2,4025,2238,
1164659,These glasses aren't right for my eyes anymore; it's difficult to see. I'm going to have to get a new pair made.,B2,4021,2239,negation
8959491,They deny everything.,B2,4013,2240,polite requests & manners
2897165,Show me the photographs!,B2,4036,2241,"at the restaurant,shopping & prices"
39357,You can get all kinds of things to eat if you go to the free samples area in a department store.,B2,4048,2242,shopping & prices
10481485,All the shops are now closed.,B2,4049,2243,
12997314,My arguments are solid.,B2,4059,2244,negation
254199,I don't know either twin.,B2,4054,2245,
3596836,The party is in full swing.,B2,4051,2246,at the restaurant
11124054,There are plenty of good restaurants round here.,B2,4045,2247,
292555,He figured out a principle.,B2,4037,2248,negation
8575111,He said that we weren't allowed to take photographs in this museum.,B2,4036,2249,at the restaurant
11537312,There are many restaurants around here.,B2,4045,2250,
2711733,The crowd grew rapidly.,B2,4042,2251,
8078990,Commit this to memory.,B2,4067,2252,
7953133,Such is my principle.,B2,4037,2253,
327348,List data can easily be totalled using the automatic sum function.,B2,4050,2254,
12144121,Are you all brave?,B2,4064,2255,
10859758,The ivy has roots growing here.,B2,4047,2256,
2840149,You'll get used to it rapidly.,B2,4042,2257,
12064356,"These shops don't get much foot traffic, and there are hardly any cars that come this way.",B2,4049,2258,
6694780,I'm not brave enough to try doing that.,B2,4064,2259,
2252481,Are you a twin?,B2,4054,2260,
9733540,Yanni bought his daughter a swing set.,B2,4051,2261,
9182100,I had gotten into a few arguments with him.,B2,4059,2262,
487654,Physics is a fundamental natural science.,B2,4087,2263,
12267040,You should have no difficulty doing that.,B2,4078,2264,
11759474,You're a fundamental part of my life.,B2,4087,2265,
3098692,He texts me all the time.,B2,4053,2266,
10632065,Do you often wear boots?,B2,4063,2267,
2319753,He could not make head or tail of it.,B2,4052,2268,
8479866,He'll alert her.,B2,4057,2269,
1085018,Look at the train crossing the bridge.,B2,4073,2270,
4478375,Have you already finished your composition for language class?,B2,4069,2271,language learning
13293204,The temperature outside is slowly dropping.,B2,4079,2272,
8479931,He has a bad knee.,B2,4098,2273,
681259,I love jokes about animals.,B2,4097,2274,animals
12209270,What kind of infection is this?,B2,4093,2275,
2360960,I hope you don't mind us dropping in.,B2,4079,2276,
7201681,Sami would greatly appreciate it.,B2,4090,2277,
8920209,The dog is crossing the road.,B2,4073,2278,animals
17140,Your composition is perfect except for a few mistakes.,B2,4069,2279,
11695836,Flavio started to make random jokes.,B2,4097,2280,
54575,Computers save us a lot of time and trouble.,B2,4070,2281,
13289598,Who is the defending champion of this tournament?,B2,4075,2282,sports
307467,They will have to cut down their expenses.,B2,4083,2283,
1402,That wasn't my intention.,B2,4095,2284,negation
7494319,Where did he go to elementary school?,B2,4081,2285,
5939635,I need your guidance.,B2,4091,2286,
267584,I miss my elementary school teachers.,B2,4081,2287,
7202360,Sami's car had serious mechanical issues.,B2,4099,2288,
1894531,Let's share the expenses.,B2,4083,2289,
12239705,A cold is an infection.,B2,4093,2290,
12095503,I might be a genius.,B2,4089,2291,
242319,The new novel added greatly to his reputation.,B2,4090,2292,
279244,"If the phone rings again, I will ignore it.",B2,4117,2293,
2360389,I have the information you requested.,B2,4114,2294,
5072018,A reward is being offered.,B2,4116,2295,
2796818,The city has many beautiful parks.,B2,4101,2296,
10371859,Pretend you're doing something.,B2,4108,2297,
12245598,I hope no one else rings now. I want to knock off.,B2,4117,2298,
11729481,Adriano's street is in a residential area.,B2,4115,2299,
2628969,His words were proven correct.,B2,4111,2300,
6255045,I wish I'd remembered to do that.,B2,4113,2301,
268415,All the passengers were requested to get off the train.,B2,4114,2302,
1879688,She took a pregnancy test.,B2,4105,2303,
4501568,They have proven themselves.,B2,4111,2304,
1970147,I didn't pretend to be your friend.,B2,4108,2305,negation
410593,Shake my hand.,B2,4121,2306,basic verbs & actions
1209987,I was the only one who didn't fall into the trap.,B2,4130,2307,
12100615,Did you go on shore leave?,B2,4122,2308,
